{
  "fixture_version": 1,
  "contract": "V2-001",
  "benchmark_store": {
    "size": 100,
    "seed": 2003,
    "logical_digest": "73701e6b7b09a5e1"
  },
  "measurement_states": [
    "measured",
    "unknown",
    "not_measured"
  ],
  "environment": {
    "host": {
      "state": "unknown"
    },
    "model": {
      "state": "unknown"
    },
    "tokenizer": {
      "state": "unknown"
    },
    "tokenizer_version_config": {
      "state": "unknown"
    },
    "cache_accounting_semantics": {
      "state": "unknown"
    },
    "measurement_provenance": {
      "state": "measured",
      "value": "local_fixture_validation"
    },
    "content_classification": "synthetic_non_private"
  },
  "workflows": [
    {
      "id": "planning",
      "initial_state": {
        "view": "ready",
        "project": "core",
        "limit": 2,
        "items": [
          "BENCH:core:025",
          "BENCH:core:022"
        ]
      },
      "stopping_condition": "A plan names both ready item IDs in priority order.",
      "success_assertions": [
        {
          "path": "plan.ids",
          "equals": [
            "BENCH:core:025",
            "BENCH:core:022"
          ]
        }
      ],
      "variants": [
        {
          "id": "v1_full_json",
          "baseline": true,
          "implementation": "implemented",
          "calls": [
            {
              "sequence": 1,
              "operation": "list_ready_json",
              "attempt": 1,
              "cache": "cold",
              "tool_schema": "bif list ready --json",
              "request_envelope": "{\"argv\":[\"list\",\"ready\",\"--project\",\"core\",\"--limit\",\"2\",\"--json\"]}",
              "response_envelope": "{\"exit_code\":0,\"stdout\":true}",
              "response_content": "{\"items\":[{\"acceptance_criteria\":[],\"assignee\":null,\"captured_at\":\"2025-01-01T00:00:12.000Z\",\"description\":\"Investigate scenario 7920 and preserve supported behavior across local developer workflows.\",\"id\":\"BENCH:core:025\",\"priority\":null,\"project\":\"core\",\"provenance\":{\"context_excerpt\":null,\"message_id\":\"message-96\",\"repository_reference\":\"bif\",\"revision_reference\":\"f3a20a1edad2a3f5\",\"source_host\":\"codex\",\"thread_id\":\"benchmark-thread-4\",\"url\":null},\"requester\":\"BENCH\",\"revision\":2,\"sequence\":25,\"status\":\"ready\",\"status_reason\":null,\"title\":\"Improve core workflow component 96\",\"updated_at\":\"2025-01-01T00:00:12.000Z\"},{\"acceptance_criteria\":[\"Criterion 1 verifies deterministic behavior for scenario 2192\",\"Criterion 2 verifies deterministic behavior for scenario 2192\"],\"assignee\":\"bob\",\"captured_at\":\"2025-01-01T00:00:11.000Z\",\"description\":\"Investigate scenario 9120 and preserve supported behavior across local developer workflows.\",\"id\":\"BENCH:core:022\",\"priority\":\"P3\",\"project\":\"core\",\"provenance\":{\"context_excerpt\":null,\"message_id\":\"message-92\",\"repository_reference\":\"bif\",\"revision_reference\":\"1439cd8cf91871ca\",\"source_host\":\"delta\",\"thread_id\":\"benchmark-thread-4\",\"url\":null},\"requester\":\"BENCH\",\"revision\":4,\"sequence\":22,\"status\":\"ready\",\"status_reason\":null,\"title\":\"Improve core workflow component 92\",\"updated_at\":\"2025-01-01T00:00:12.000Z\"}],\"next_offset\":2}\n",
              "follow_up": "{\"plan\":{\"ids\":[\"BENCH:core:025\",\"BENCH:core:022\"]}}",
              "proxy_utf8_bytes": {
                "tool_schema": 21,
                "request_envelope": 67,
                "response_envelope": 29,
                "response_content": 1388,
                "follow_up": 52
              },
              "total_proxy_utf8_bytes": 1557,
              "tokens": {
                "prompt": {
                  "state": "unknown"
                },
                "completion": {
                  "state": "unknown"
                },
                "cached": {
                  "state": "unknown"
                },
                "uncached": {
                  "state": "unknown"
                }
              },
              "completion_time_ms": {
                "state": "not_measured"
              }
            }
          ],
          "totals": {
            "proxy_utf8_bytes": 1557,
            "tokens": {
              "state": "unknown"
            },
            "completion_time_ms": {
              "state": "not_measured"
            }
          },
          "outcome": {
            "state": "not_measured"
          }
        },
        {
          "id": "v1_compact_human",
          "baseline": true,
          "implementation": "implemented",
          "calls": [
            {
              "sequence": 1,
              "operation": "list_ready_human",
              "attempt": 1,
              "cache": "cold",
              "tool_schema": "bif list ready",
              "request_envelope": "{\"argv\":[\"list\",\"ready\",\"--project\",\"core\",\"--limit\",\"2\"]}",
              "response_envelope": "{\"exit_code\":0,\"stdout\":true}",
              "response_content": "BENCH:core:025\tready\t-\t-\tImprove core workflow component 96\nBENCH:core:022\tready\tP3\tbob\tImprove core workflow component 92\nNext offset: 2\n",
              "follow_up": "{\"plan\":{\"ids\":[\"BENCH:core:025\",\"BENCH:core:022\"]}}",
              "proxy_utf8_bytes": {
                "tool_schema": 14,
                "request_envelope": 58,
                "response_envelope": 29,
                "response_content": 138,
                "follow_up": 52
              },
              "total_proxy_utf8_bytes": 291,
              "tokens": {
                "prompt": {
                  "state": "unknown"
                },
                "completion": {
                  "state": "unknown"
                },
                "cached": {
                  "state": "unknown"
                },
                "uncached": {
                  "state": "unknown"
                }
              },
              "completion_time_ms": {
                "state": "not_measured"
              }
            }
          ],
          "totals": {
            "proxy_utf8_bytes": 291,
            "tokens": {
              "state": "unknown"
            },
            "completion_time_ms": {
              "state": "not_measured"
            }
          },
          "outcome": {
            "state": "not_measured"
          }
        },
        {
          "id": "v2_contract",
          "baseline": false,
          "implementation": "not_implemented",
          "calls": [
            {
              "sequence": 1,
              "operation": "list_summary",
              "attempt": 1,
              "cache": "unknown",
              "tool_schema": "bif --api-version 2 list ready --project core --projection summary --limit 2 --json",
              "request_envelope": "{\"view\":\"ready\",\"project\":\"core\",\"projection\":\"summary\",\"limit\":2}",
              "response_envelope": "{\"api_version\":2,\"schema_version\":1,\"ok\":true}",
              "response_content": "{\"items\":[{\"id\":\"BENCH:core:025\",\"title\":\"Improve core workflow component 96\",\"status\":\"ready\",\"priority\":null,\"assignee\":null,\"revision\":2},{\"id\":\"BENCH:core:022\",\"title\":\"Improve core workflow component 92\",\"status\":\"ready\",\"priority\":\"P3\",\"assignee\":\"bob\",\"revision\":4}],\"next_cursor\":\"cursor-page-2\"}\n",
              "follow_up": "{\"plan\":{\"ids\":[\"BENCH:core:025\",\"BENCH:core:022\"]}}",
              "proxy_utf8_bytes": {
                "tool_schema": 83,
                "request_envelope": 66,
                "response_envelope": 46,
                "response_content": 305,
                "follow_up": 52
              },
              "total_proxy_utf8_bytes": 552,
              "tokens": {
                "prompt": {
                  "state": "unknown"
                },
                "completion": {
                  "state": "unknown"
                },
                "cached": {
                  "state": "unknown"
                },
                "uncached": {
                  "state": "unknown"
                }
              },
              "completion_time_ms": {
                "state": "not_measured"
              }
            }
          ],
          "totals": {
            "proxy_utf8_bytes": 552,
            "tokens": {
              "state": "unknown"
            },
            "completion_time_ms": {
              "state": "not_measured"
            }
          },
          "outcome": {
            "state": "not_measured"
          }
        }
      ],
      "error_retry_specifications": [
        {
          "id": "reject-mutually-exclusive-list-filters",
          "trigger_precondition": "The list request sets both an assignee and unassigned true, which V2-001 declares mutually exclusive.",
          "operation": "list",
          "request_shape": {"view": "ready", "project": "core", "assignee": "alice", "unassigned": true, "projection": "summary", "limit": 2},
          "expected_error": {"code": "invalid_input", "assertions": ["ok is false", "error.code is invalid_input", "storage is not accessed"]},
          "retryability": "not_retryable",
          "retry_or_termination_policy": "Terminate; correct the request before a new attempt.",
          "expected_subsequent_request_behavior": "No cursor is accepted or advanced; a corrected request starts without a cursor.",
          "execution_state": "not_executed",
          "attempts": [],
          "evidence": []
        }
      ],
      "reset_before_variant": {
        "method": "regenerate_benchmark_store",
        "size": 100,
        "seed": 2003,
        "logical_digest": "73701e6b7b09a5e1"
      }
    },
    {
      "id": "select_and_execute",
      "initial_state": {
        "selected": "BENCH:agent-tools:001",
        "status": "ready",
        "revision": 4,
        "project": "agent-tools"
      },